,0
558,"Estuvimos hospedados por un fin de semana, desde el Check In el servicio por parte de la recepción fue pésimo, nadie sonríe, es básicamente un ""Quien eres y como vas a pagar?"" Tuvimos un inconveniente con la facturación y lo hicimos saber al Check In. Durante nuestra estadía nadie nos hablo al respecto, no se hizo seguimiento, nadie esta pendiente de nada. El hotel esta ubicado al lado de una serie de bares, no esta protegido acusticamente, asi que tienes el ruido incesante al lado.  En la noche las personas de seguridad se sientan a ver Facebook en los PC del lobby con vallenatos a fuerte volumen, entramos 3 veces, nadie te dice nada. El desayuno esta bueno, es Buffet, tiene variedad de productos, muchos autoctonos, y las personas están pendientes hasta de llenarte la taza de"
559,…
560,"La mejor atención, necesite un poco de bloqueador y las personas del hotel me consiguieron, las camas muy cómodas y la comida del room service deliciosa, a igual que el desayuno que tiene gran variedad para escoger."
561,"Hotel tradicional Four Points, excelente hotel para estadía de negocios.   El buffet al desayuno es variado, encuentras frutas, huevos, panes, cereales, jugos. Lo mejor de todo es la vista a la piscina.   Las habitaciones son cómodas junto a su aire acondicionado.   El servicio es excelente.   También recomiendo las empanadas si debes pasar algún espacio en el business center, o los sándwich.  "
562,"*Cuando hicimos el check in le pregunte al recepcionista si tenía suites disponibles, a lo cual me respondió que tenían 2 junior suites. Yo le dije que había visto que ellos eran parte del pasaporte American Express, y que con mi tarjeta podía solicitar un upgrade a una suite; después de unos minutos el Sr. me dice que no hay disponibilidad, pues ambas están ocupadas... Esto me pareció un poco raro...Como si simplemente no lo hubieran querido otorgar, lo cual es una lástima pues se pierde el propósito de estas alianzas comerciales... *Al día siguiente solicitamos late check out y antes de la hora pactada para salir la mucama entro a la habitación sin tocar mientras nos estábamos cambiando, luego recibimos dos llamadas de la recepcionista de turno pidiéndonos que confirmáramos si"
563,…
564,"Estándar como todos los four points. Buenas habitaciones y un excelente servicio. No hay sorpesas. Siempre me va bien. Puede haber hoteles más sofisticados, pero ninguno con tan buena relación precio/calidad. La ubicación es buenísima. Es siempre mi primera elección para viajes de trabajo en Barranquilla. Le sugeriría al hotel que ampliaran los horarios de la piscina, para poder nadar en la noche. "
565,"Este hotel tiene todo lo necesario para hacerte sentir muy bien, sin ganas de irte. Desde que llegas te dan un cóctel de bienvenida y la atención que brindan es muy buena, las instalaciones son muy bonitas y completas. Recomendable 100%!!"
566,"El Hotel cuenta con una ubicación muy privilegiada y una excelente atención, sin duda me volvería a hospedar en el, las tarifas son bastante accesibles y el desayuno es bastante completo, internet optimo"
567,"Una estancia excelente, la habitación confortable y limpia, la atención de todo el personal de maravilla y no puedo dejar de mencionar la gastronomía tanto en desayuno como almuerzo platos de primera. 100% recomendable."
568,"Está ubicado en una zona estratégica de la ciudad, y aunque solo estuve por dos noches hay que reconocer el muy buen servicio. Nos atendieron de manera espectacular incluso cuando llegamos al hotel a la 1:30 am, las habitaciones son espaciosas y muy bien dotadas ya sea para familia o negocios y el buffet de desayuno es muy completa. 100% recomendado"
569,Es un hotel muy bonito Confortable y muy bien ubicado La comida es exquisita muy bien presenta y platos muy variados .El servicio insuperable desde la llegada recepción restaurante etc  Buen Gimnasio  Lo único a mejorar es la piscina muy pequeña  
570,"Me hospede por dos noches y debo decir que es de las mejores estadías que he tenido en la ciudad. El servicio al cliente es como ningun otro hotel en barranquilla. Muy atento, servicial y amable. El desayuno espectacular! Variado, fresco y de excelente sabor.  Por mejorar: la piscina no es divertida, no hay quioscos por los cual el sol calienta mucho y no hay donde resguardarse. La piscina es como para niños.   Por mejorar en la habitación: el aire. Al tener techo alto, el central no enfríaba muy bien. Estaba en la habitación 706 y no había calor pero escasamente estaba ""fresca"". La ducha espectacular!!!!!  Muy relajante y con buena presión.   Volvería sin duda pero NO con vestido de baño."
571,"El hotel cuenta con una ubicación excelente, rodeado de sitios para comer, comprar, etc. El personal es muy atento y cordial. Las habitaciones  son amplias y muy cómodas. La limpieza es impecable. El desayuno es variado y de buena calidad. Es un hotel enfocado más en ejecutivos que familias con niños. "
572,"El servicio de este hotel es extraordinario, el personal de Front Desk muy preparado y con excelente nivel de servicio, la ubicación del Hotel Buena y la relación calidad - precio acorde a la categoría del mismo."
573,"Excelente servicio prestado por todos los empleados, en especial el Jefe de calidad y el recepcionista, que crearon empatía con nosotros y saciaron todas las inquietudes que teníamos.  La habitación espectacular, su limpieza y aroma totalmente acogedor, disponibilidad de electrodomésticos y utensilios para hacer de nuestra estadía inolvidable.  Su ubicación estratégica, me permitió llegar y salir sin problemas ni sobre costos en los taxis.  Creí que le iba a dar una sorpresa a mi esposa y el sorprendido fui yo, al estar en presencia de tal majestuoso Hotel."
574,"De manera general el hotel es Excelente, una muy buena ubicación cerca de parques restaurantes, bares y centros comerciales, el servicio también, me gustó el detalle de recibir a sus huéspedes con una bebida especial de la casa, un buen toque. Sin embargo, pienso que el punto débil sería la piscina, está adecuada básicamente para la altura de los niños, y esto puede ser un poco incómodo para un adulto dado que la profundidad es muy poca. Pienso que el área de piscina les permite ofrecer una solución a este inconveniente o construir una piscina que sea para adultos."
575,"Estuve en el restaurante de este hotel, en efecto apenas entre me ofrecieron una copa de vino de cortesia y poco despues me trajeron la entrada la cual contiene diferentes tipos de panes con mantequilla, de repente me sorpendio cuando el mesero me explico que tipo de panes eran y despues le ordene que me trajera un plato fuerte de langostinos; por otra parte el unico problema fue que el plato fuerte me parecio algo pequeño y ellos me ofrecieron papas a la francesa gratis entonces yo acepte, en conclusion pienso que la cortesia fue impecable, de hecho al final de comer me dieron un I pad prestado para calificar el servicio, solamente sugeriria que le echen mas comida a los platos fuertes.o"
576,"Es un Hotel ubicado en el mejor sector de la ciudad a pocos pasos del parque Washington, rodeado de restaurantes, bares, centros comerciales, cines, el personal es muy eficiente y amable, las habitaciones son amplias, limpias y bonitas, la cama es muy rica, sabanas y toallas impecables, la ducha muy limpia y amplia, el aire acondicionado funciona perfecto, el desayuno es en el restaurante Kitchen by Rausch con mucha variedad y todo muy delicioso, fue una muy buena experiencia volveremos pronto.100% recomendado !"
577,"Este bote está ubicado en una zona de mucho movimiento de bares y restaurantes lo que lo hace ideal para salir a caminar, especialmente en la noche.   El hotel es de tamaño mediano pero con habitaciones amplias y cómodas. Tiene una terraza con muy buen ambiente los fines de semana y en su primer piso muy buena comida en su restaurante Kitchen by Rausch.   Buena opción en Barranquilla. "
578,"Es un hotel muy acogedor, las personas que trabajan son atentas, la habitación cuenta con una cama  grande y super cómoda, El desayuno brinda opciones para escoger. Nos encantó y volveríamos a ir sin pensarlo dos veces.."
579,Las habitaciones son bastante cómodas y amplias. Es muy conveniente el restaurante para el room service y los platos son muy buenos. El personal es muy servicial y agradable. La conexión a internet molestó un poco y el password se vence cada 3 días lo cual puede ser molesto si vas por muchos días.
580,"Como todos los Sheraton, el servicio y las habitaciones son excelentes. El desayuno es delicioso. No dejen de ir al bar del ultimo piso. Lo único regular del hotel es la piscina, pero en general es un excelente hotel. No visité el restaurante del hotel, pero he escuchado buenas recomendaciones."
581,"Tiene buena ubicación, el personal es amable, los cuartos son básicos pero la cama es muy cómoda, no tienen servicio de lavandería dentro del hotel por lo que la ropa se puede demorar un poco en que se la traigan."
582,"El hotel me gustó! Temperatura ideal en la habitación, la cama y almohadas, inmejorables!! Se puede conseguir un verdadero descanso allí. Además está ubicado es una zona cerca a todo, bares, restaurantes, centros comerciales, etc. Lo no tan bueno: avisaron al hacer el check in que por condiciones climáticas no iba a estar disponible la piscina, al día siguiente dijeron que era por mantenimiento. Eso nos confundió, dieron dos informaciones distintas. Adicionalmente, el restaurante nos decepcionó un poco, pedimos un filete de carne a la pimienta y la salsa estaba algo ácida, nos la cambiaron tres veces sin lograr que saliéramos satisfechos por el sabor. Por lo demás, la atención de personal, la limpieza y ubicación, les doy un 10!"
583,"Estuve hospedado por 4 noches y fue una grata experiencia buenas habitaciones comodas con las amenidades esenciales , personal atento y dispuesto a ayudar en cualquier situación, excelente desayuno variable y fresco , almorce en el Restaurante Kitchen by Rausch y excelente comida recomendable , Chelsea's rooftop muy bueno en las noches buen ambiente excelentes gin's y musica acorde a la ocasion , buena ubicacion cerca a buenos restaurantes ."
584,"Es un buen Hotel, amplias habitaciones y muy limpias. Buen desayuno bastante variado. Deben advertir a los visitantes sobre la piscina que es bastante pequeña y la política que tienen de usar gorro de baño para acceder a ella. Por lo demás lo recomiendo totalmente."
585,"Buenas habitaciones, sin embargo deberían mejorar el diseño de la ducha para que no se moje tanto el piso del baño y evitar accidentes.  No me gustó la piscina, a pesar de que la foto del hotel muestra una piscina infinita deseable, no lo es así. Pienso que la pueden sofisticar un poco mas.  EXCELENTE buffet del desayuno.     EXCELENTE ubicación, cerca de bares, restaurantes, etc."
586,"Tuve una experiencia un poco aburridora, pues resulta q la habitación q me dieron tenía dañads las baterías de la puerta donde se pone la tarjeta para abrirla, pero entonces primero llegaron a abrir la habitación sin golpear o preguntar primero si había alguien dentro y dejaron así por verguenza cuando pregunte quien era, luego que salí a comer y no pude entrar me toco ir a la recepción a pedir colaboración, y esperar por media hora para que cambiaran las baterías, eran cerca de las 10 pm y luego de que finalmente pude entrar a la habitación nuevamente llegó alguien a intentar abrir, no se si es que no tienen comunicación interna pero si es muy jarta esa situación que no podía estar como en mi privacidad tranquila porque en cualquier momento me abrían la puerta. Entiendo que"
587,…
588,Un hotel sencillamente cómodo y hermoso. Es muy moderno y el servicio es excelente. Un hotel que lo tiene todo y lo tiene muy bueno. Me encanto el restaurante las habitaciones son amplias y las camas son excelentes.  Un hotel de negocios pero no para vacacionar. Es un hotel de excelente calidad 
589,"Es un buen sitio, nuevo limpio y de personal atento, lo recomiendo estuve con mi familia y quedamos muy a gusto. Tiene buena presentacion. Buena relación precio costo. Esta ubicado en un buen sector de la ciudad."
590,"Tiene buena ubicación en barranquilla ,personal atento , tiene una linda vista en el último piso donde puedes ver barranquilla la piscina es muy pandita pero bueno está bien para refrescarse,  tiene baño turco hasta las 7 pm y alrededor hay varios lugares para tomarse una cerveza o salir con tus amigos."
591,"Un muy buen Hotel, me gusta su ubicación cerca de varios restaurantes en el área, también hay cerca un centro comercial, la acomodación estuvo muy bien, la habitación muy cómoda, el proceso de Check In y Out no tuvo ningún contratiempo.  Una observación es en el momento del desayuno, el cual se puede tomar hasta las 10 AM, y cuando lo tome a las 9:00, ya el Pan y el queso no se veían muy frescos. En general es un desayuno bueno y variado. El internet no es rápido pero se puede sobrevivir, para enviar y recibir mail, sería bueno mejorar la velocidad Otro aspecto a destacar es un poco la falta de cordialidad del Staff, sin decir que sean malos, pero pienso que falta de pronto un buen saludo, con una sonrisa es algo que agrada, sobre todo en horas de la mañana. (Personalmente no lo"
592,…
593,"Hola, visité el hotel en diciembre 2014  cuando eran nuevos, la habitación muy bonita, la cama excelente pero a las 3am tenia unos vecinos borrachos q interrumpieron mi sueño!! Pero luego de 20 mins todo regresó a la normalidad, el desayuno lo mejor, aunque no tenían buffete (por motivos de ocupación) el desayuno americano y el costeño muy bonitos, ah y la salchipapa q pedí en la noche muy buena jajaja."
594,"Excelente lugar para descansar, disfrutar en familia... las habitaciones son acogedoras, las camas y sus sábanas super deliciosas.... ni que decir de la excelente comida.. La atención es muy buena, camareras y meseros bien atentos y amables, al igual que los botones y recepcionistas. Felicitaciones "
595,"Un hotel muy cómodo, muy agradable, con una atención muy buena por parte del personal, sus instalaciones son muy lindas, las habitaciones están bien dotadas, cómodas y aseadas, baño amplio, bien dotado, excelente servicio al cuarto. El hotel tiene muy buena relación costo-beneficio, cerca de los lugares de interés en barranquilla, tiene parqueadero auqnue si llegas tarde no encuentras."
596,"La atención es excelente, en especial en recepción, muy amables y serviciales. La habitación muy linda y la cama muy cómoda. Bien ubicado y el desayuno delicioso. Lo que mas me gusto fue el servicio de sus funcionarios."
597,"los chicos de seguridad siempre dispuestos  a colaborar en el parqueadero y en el lobby, el desayuno es muy típico lo que realmente me fascino. las camas blandas y ricas y la ubicaion excelente. ( centros comerciales, restaurantes)"
598,"Fuimos solo una noche durante un festivo entonces no sabría si es siempre así. La piscina es en realidad un poco pequeña y esa área podría estar mejor ambientada. El bar estaba cerrado. Las habitaciones si son muy cómodas y lindas, la cama es de las más cómodas que he probado en hoteles nacionales, también nos gustó que la ducha se regulará desde la pared contraria de la regadera. Nos gustó que tenía una pequeña máquina para hacer té o café en la habitación, aunque el café era casi imposible de abrir sin tijeras y era descafeinado, muy malo eso. El desayuno no fue malo pero había poca variedad, esperaba mucho más de un hotel que promociona comida de autor.  El servicio fue bueno, especialmente la señorita que tomó nuestro pedido de room service un domingo por la noche,"
599,…
600,"No tienen control del equipaje,  el mío se lo entregaron a otro huésped y tardaron más de 3 días en recuperar lo. Tuve que hacer el seguimiento porque la comunicación conmigo no era frecuente. Incluso me dijeron que fuera yo misma a recoger el equipaje que ellos habían perdido.."
601,Four point by sheraton HOTEL BARRANQUILLA Durante mi estadia el dia mi check out baje a desayunar y cuando subi a la habitacion hacian falta 100 euros. Como propietario de un hotel conozco que en una habitacion que tiene check out no debe entrar la camarera hasta que se realize el respectivo check out. Al momento de informar la representante dle hotel me informo que me iban a devolver el dinero y 1 semana despues me informaron que no. EN ESTE HOTEL ROBAN  Y NO RESPONDEN
602,"Mal servicio. Se les olvido colocar toallas del baño, NO habia agua caliente en la ducha, se oye practicamente todo el ruido de las habitaciones del lado y corredores. Camareras constantemente golpean la habitacion (asi haya la señal de no molestar)."
603,"El hotel cuenta con habitaciones bastante agradables, la cama es realmente cómoda, está bien ubicado cerca de bares y restaurante de la ciudad, la atención de su personal es muy buena, siempre atentos a las necesidades de los clientes. Muy buen desayuno, rico y variado. La zona de la piscina le falta un poco más de mantenimiento y mejor aseo."
604,"El hotel esta bien aunque ha bajado su categoría... Hoy todo cerrado, bar en la piscina, en el lobby y cerrado su restaurante !!! Según los empleados por carnaval! Y todos los huéspedes sin servicio! A comer fuera! Le falta limpieza y mantenimiento a sus áreas comunes! Insisto en que no podemos competir con destinos internacionales, con esta mentalidad primitiva. "
605,"Lo mejor, la ubicacion cerca a centros comerciales, restaurantes y bares. La atencion muy buena y las habitaciones comodas pero ruidosas porque se escuchan los TV y conversaciones de las habitaciones vecinas. El desayuno estaba incluido y fue muy bueno y variado. Definitivamente regresare."
606,"En general mi experiencia fue muy buena, las habitaciones son bastante agradables, las camas son bastante cómodas, el desayuno es variado y delicioso, el personal es muy amable y te resuelven cualquier duda respecto a sitios turísticos de la ciudad o de la región, quiero agradecer especialmente la atención prestada en el restaurante Kitchen by Rausch y en la recepción, se nota la calidad humana del personal, la ubicación del hotel inmejorable, la única sugerencia es que le dedicaran un poco mas de tiempo al aseo de área de piscina, lo demás estuvo perfecto, me sentí como en casa,sin duda regresaría!!"
607,"Muy buen hotel, con algunos problemas operativos (a veces no asean las habitaciones), y siendo uno de los pocos con piscina en Barranquilla, esta se encuentra totalmente desaprovechada y no es nada atractiva: sillas sin parasoles, no hay musica, no hay venta de refrescos, el agua de la piscina no es transparente (queda la duda de si es por suciedad o por algun quimico, mis hijos no quisieron volver a ella). Sin embargo es muy buen hotel. Desayuno excelente."
608,"excelente todo el serviciodel hotel el personal bien equipado,el restaurante buen servicio de comida a la cartas las habitaciones todo confort la piscina bien elegante extraordinaria el lobby de primera categoria."
609,"La atención es muy buena, pero le hace falta meseros en la piscina y también un poco dé ambiente tal vez un poco de música sería suficiente, la comida By Rausch es exquisita y ni hablar de las habitaciones, muy limpias. Si volvería a hospedarme en el Four Points By Sheraton Barranquilla."
610,"El hotel está ubicado en una buena zona, cerca a restaurantes y centros comerciales lo cual permite que la experiencia sea buena, el servicio del personal es muy bueno, todos fueron muy amables de principio a fin, la habitación estaba bien equipada y limpia que es lo más importante, finalmente la comida y las bebidas son algo a destacar ya que son excelentes."
611,"Recomiendo ciegamente el hotel Four Points By Sheraton Barranquilla, por sus instalaciones y comodidad. El personal nos brinda excelente atención y amabilidad, en especial, el sr Fabio Teheran, quien es muy cordial, siempre dispuesto a brindarnos información, no solo del hotel sino también de todo lo que el huesped necesite. el desayuno y cena en el restaurante delicioso, cada 15 días viajo a Barranquilla y siempre es el hotel que elijo para mi estancia."
612,"apreciados lectores  de nuevo estoy muy gratificado con la exelente atencion de todo el personal, en especial el front desk y resto de esta familia en el four points Sheraton de barranquilla en especial doy mi reconocimiento al SR Vicente Ospina quien siempre ha estado muy atento en todas mis visitas. El desayuno estuvo a su nievel de altura y servicio, asi como las habitaciones y demas servicios Espero aun la super instalacion de la piscina y demas servicos en la parte alta de la torre del hotel atte  Eduardo Valencia"
613,"somos la familia Martinez villadiego, nos hemos hospedado todo el año en este hotel ,porque nos sentimos en casa y muy a gusto . el desayuno es muy delicioso y el personal que nos atiende son muy atentos , sobretodo con Vicente ospina que nos ha ayudado y colaborado durante toda nuestra estadía por el hotel . esta muy bien ubicado y todo queda cerca. agradecemos mucho su colaboración por los late check outs , porque son flexibles y eso nos ha facilitado con nuestras ocupaciones . esperamos seguir en este hotel y gracias por sus atenciones ."
614,"Buenos Días, mi nombre es Carlos Hernández, me pareció muy buena la atención brindada por   parte del personal que labora en el hotel, en especial  la atención brindada por fabio teherar y la atención brindada por parte del personal del restaurante, los platos que se digustan son muy bien elaborados (ricos), en cuanto a las habitaciones son muy confortables y cómodas, la Terraza es un lugar amplio donde se comparte y también se puede pasar un rato agradable en la piscina."
615,"Mi nombre es daladier osorio me pareció muy buena la estadía, considero  que tienen muy buena disposición por parte del personal logístico en especial de Vicente al igual excelente servicio de restaurante"
616,Buen hotel para ir de negocios. Habitaciones muy cómodas. El restaurante es by Rausch. Un poco costoso para las porciones. La atención en general del hotel es muy buena. Excelente ubicación. Agradable la terraza.
617,"Estuve 2 noches, el hotel es my bonito y muy bien cuidado, los cuartos son amplios y las camas super comodas, el baño aunque es lindo y moderno es pequeño. el restaurante es muy lindisimo con buen ambiente y comida muy rica, y los postres deliciosos. del hotel al aeropuerto hay aproximadamente 40 minutos. Lo recomiendo"
618,Se encuentra en uno de los barrios mas lindos de barranquilla. A pocos metros hay un mall para salir a distraerte si es que estas alojado por negocios como fue mi caso. Las habitaciones son espaciosas y calidas. El servicio de restaurante es excelente y las personas que me atendieron fueron muy cordiales; se aseguraron que me sienta como en casa.
619,"El hotel cuenta con una ubicación excelente. Pero los servicios que ofrece no son los mejorer, el personal en general es muy amable y servicial, pero el personal del lobby le falta mucho por apreder sobre servicio al cliente, estar bien vestidos no reemplaza el buen servicio. Y cuando uno hace una reserva solicitando algo es porque en realidad lo necesita y si no lo pueden hacer no lo ofrezcan."
620,"Este hotel es muy bueno, con habitaciones espaciosas y muy buen servicio de desayuno. Está ubicado en un lindo barrio y tiene cerca lugares para comer y hacer compras muy recomendables. La atención es excelente. Todos son muy amables. Destaco a Daniela, en la recepción. Tuvimos el inconveniente que en nuestro piso, algunas personas se emborracharon y drogaron y, durante una noche y el escándalo no nos dejó descansar bien. Sabemos que las personas salieron del hotel a la mañana siguiente y nos pidieron disculpas."
621,"Este hotel es una pesadilla, es en serio que es de la cadena sheraton????,  pesima atención, manejan una modalidad pago por anticipado que no funciona para nada, vine por negocios y llegue cansado a las 3pm y por sorpresa ni siquiera habían hecho el servicio de limpieza en la habitación. si su intensión es venir por trabajo o descansar evitese la molestia de hospedarse en un hotel tan malo. que triste seleccionar un hotel por el respaldo de la cadena sheraton y que en realidad la experiencia huésped sea pesima."
622,"Estuve hospedado una noche con mi novia. Lo primero que tengo que decir es que el desayuno es increible! Muy rico! Y variado!. La habitacion estaba bastante bien, pues normal para un hotel de esta categoria. Todo limpio !!. No se que, pero lo califico 4/5 no se pero siento q falto algo mas! Para que fuera 5/5. Eso si! El Personal muy atento desde que llegamos del aeropuerto!!!"
623,"El hotel es nuevo y está muy bien, las habitaciones y general todas las instalaciones no tienen problema.   El desayuno completo y el restaurante, que es delos Raush, es muy bonito (entre lo que se ve en los hoteles)  el único pero, que además es importante, es que hay muy poco aislamiento acústico entre habitaciones y se oye todo lo que hablan en los cuartos vecinos, los ruidos de las griferías, las alarmas de los despertadores, etc."
624,"La avena que ofrecen en el desayuno es la mejor del mundo!!! Las habitaciones muy cómodas,pero se alcanza a oír de las habitaciones contiguas. Se nos quedo una maleta y la enviaron a casa, lastimosamente le faltaban objetos y estaba escarbada, nada costoso, pero deben mejorarlo. La experiencia en general muy satisfactoria. Volvería"
